{"type":"config","name":"Local Waypoints Calculator Parity with Cloud API","metricName":"duration_gap_pct","metricUnit":"%","bestDirection":"lower"}
{"run":1,"commit":"8a47030","metric":24.65,"metrics":{"local_duration":9.8108,"cloud_duration":7.8705,"local_max_dev":0.265393,"cloud_max_dev":0.260108,"local_mean_dev":0.096482,"cloud_mean_dev":0.108519},"status":"keep","description":"Baseline: local 9.81s vs cloud 7.87s, 24.65% gap","timestamp":1776487855014,"segment":0,"confidence":null,"iterationTokens":933,"asi":{"hypothesis":"baseline measurement","root_cause":"build_geometry includes every waypoint as per-DoF section boundary, forcing v=0 at monotonic pass-throughs per paper §III-B only true local extrema need v=0"}}
{"run":2,"commit":"8143007","metric":9.13,"metrics":{"local_duration":8.5893,"cloud_duration":7.8705,"local_max_dev":0.356606,"cloud_max_dev":0.260108,"local_mean_dev":0.108545,"cloud_mean_dev":0.108519},"status":"keep","description":"Switch build_geometry to true local extrema only (paper §III-B). Duration gap 24.65%→9.13%, max_dev 0.265→0.357","timestamp":1776487878802,"segment":0,"confidence":null,"iterationTokens":1975,"asi":{"hypothesis":"Only use true local extrema as per-DoF section boundaries, matching paper §III-B","result":"Major duration improvement (9.81→8.59s), but max_dev increased (0.265→0.357) vs cloud's 0.260","next_step":"Reduce path deviation while keeping the duration gain - need to improve the tracking/interpolation for monotonic pass-through waypoints"}}
{"run":3,"commit":"6214931","metric":4.2,"metrics":{"local_duration":8.201,"cloud_duration":7.8705,"local_max_dev":0.467332,"cloud_max_dev":0.260108,"local_mean_dev":0.209069,"cloud_mean_dev":0.108519},"status":"keep","description":"Remove pre-alignment, pass initial v/a directly to core. Duration gap 9.13%→4.20%, but max_dev 0.36→0.47","timestamp":1776488207314,"segment":0,"confidence":4.1480730223123725,"iterationTokens":31361,"asi":{"hypothesis":"Remove pre-alignment so core handles non-zero initial v/a directly, avoiding 0.71s braking overhead","result":"Duration improved 8.59→8.20s (gap 9.13%→4.20%), but deviation worsened (max 0.36→0.47, mean 0.11→0.21)","issue":"Non-zero initial velocity/acceleration causes tracking issues - DoFs with initial motion overshoot the reference path more easily","next_step":"Fix deviation by improving tracking for DoFs with non-zero initial state, especially near section boundaries"}}
{"run":4,"commit":"6214931","metric":12.6,"metrics":{"local_duration":8.862,"cloud_duration":7.8705,"local_max_dev":0.426414,"cloud_max_dev":0.260108,"local_mean_dev":0.212678,"cloud_mean_dev":0.108519},"status":"discard","description":"Smaller delta_u_ref (0.005) made everything worse - duration 8.86, kinematic fail","timestamp":1776488272739,"segment":0,"confidence":4.8690476190476195,"iterationTokens":5527,"asi":{"hypothesis":"Smaller delta_u_ref makes tracking tighter and reduces deviation","result":"Worse on all metrics: duration 8.20→8.86, max_dev 0.47→0.43 (slightly better), kinematic FAIL","rollback_reason":"Duration and kinematic limits regressed","next_action_hint":"Try larger delta_u_ref or different approach to reduce deviation"}}
{"run":5,"commit":"6214931","metric":4.77,"metrics":{"local_duration":8.246,"cloud_duration":7.8705,"local_max_dev":0.474609,"cloud_max_dev":0.260108,"local_mean_dev":0.207192,"cloud_mean_dev":0.108519},"status":"discard","description":"Larger delta_u_ref (0.02) slightly worse duration 8.25 vs 8.20","timestamp":1776488321810,"segment":0,"confidence":4.6903669724770625,"iterationTokens":1020,"asi":{"hypothesis":"Larger delta_u_ref gives tracking more room, might reduce oscillation","result":"Slightly worse on all metrics, delta_u_ref tuning not the right lever","next_action_hint":"Focus on section transition logic and dwell time elimination"}}
{"run":6,"commit":"6214931","metric":9.48,"metrics":{"local_duration":8.6169,"cloud_duration":7.8705,"local_max_dev":0.47276,"cloud_max_dev":0.260108,"local_mean_dev":0.204945,"cloud_mean_dev":0.108519},"status":"discard","description":"Set a=m*af_fast at section transitions caused kinematic failure and worse duration","timestamp":1776488359567,"segment":0,"confidence":5.223499361430395,"iterationTokens":4551,"asi":{"hypothesis":"Setting acceleration to m*af_fast at section transitions eliminates dwell time","result":"Kinematic FAIL and duration worse (8.62 vs 8.20). The acceleration jump violates jerk limits.","rollback_reason":"Kinematic failure and worse duration","next_action_hint":"Need smoother section transition - can't just snap acceleration"}}
{"run":7,"commit":"d249a59","metric":-0.01,"metrics":{"local_duration":7.8696,"cloud_duration":7.8705,"local_max_dev":0.415769,"cloud_max_dev":0.260108,"local_mean_dev":0.149142,"cloud_mean_dev":0.108519},"status":"keep","description":"Fix forward_position_to_s braking overshoot + bounds check: duration gap 4.20%→-0.01% (7.87s vs 7.87s!). Deviation still higher (0.42 vs 0.26).","timestamp":1776488487871,"segment":0,"confidence":5.223499361430395,"iterationTokens":2498,"asi":{"hypothesis":"Fix forward_position_to_s to handle braking overshoot positions, and extend bounds in advance_one_dof","result":"Duration gap virtually eliminated (7.87s vs 7.87s). Max deviation 0.42 vs cloud 0.26, mean 0.15 vs cloud 0.11","key_fix":"forward_position_to_s was incorrectly mapping overshoot positions to wrong sections, causing s_dt and m calculation errors. Also extended section bounds for braking overshoot.","next_step":"Reduce path deviation from 0.42 to closer to cloud's 0.26 while keeping duration parity"}}
{"run":8,"commit":"d249a59","metric":-0.06,"metrics":{"cloud_duration":7.8705,"cloud_max_dev":0.260108,"cloud_mean_dev":0.108519,"local_duration":7.8656,"local_max_dev":0.41168,"local_mean_dev":0.149557},"status":"discard","description":"Smaller sim_dt no help for deviation","timestamp":1776488718876,"segment":0,"confidence":5.223499361430395,"iterationTokens":6799,"asi":{"hypothesis":"Smaller sim_dt (0.001) for finer tracking resolution reduces deviation","next_action_hint":"Try structural approach - improve u_ref initialization or add waypoint constraints","result":"No improvement in deviation. Tracking quality not limited by discretization.","rollback_reason":"No improvement, takes longer to compute"}}
{"run":9,"commit":"d249a59","metric":17,"metrics":{"cloud_duration":7.8705,"cloud_max_dev":0.260108,"cloud_mean_dev":0.108519,"local_duration":9.2085,"local_max_dev":0.45761,"local_mean_dev":0.146992},"status":"discard","description":"All waypoints with bounds fix: duration 9.21s (worse), deviation 0.46 (still bad)","timestamp":1776488835298,"segment":0,"confidence":4.341825902335455,"iterationTokens":4586,"asi":{"hypothesis":"Re-add all waypoints as section boundaries with v=0 to reduce deviation","next_action_hint":"Use selective waypoint inclusion or improve tracking quality","result":"Duration much worse (9.21 vs 7.87s) and deviation barely improved (0.46 vs 0.42). All-waypoints approach doesn't work even with bounds fixes.","rollback_reason":"Duration regressed significantly"}}
{"run":10,"commit":"d249a59","metric":32.56,"metrics":{"cloud_duration":7.8705,"cloud_max_dev":0.260108,"cloud_mean_dev":0.108519,"local_duration":10.433,"local_max_dev":0.572566,"local_mean_dev":0.313535},"status":"discard","description":"Pass-through velocity approach: catastrophic - duration 10.43s, deviation 0.57, kinematic fail","timestamp":1776489816802,"segment":0,"confidence":3.3442354865085853,"iterationTokens":4596,"asi":{"hypothesis":"Add pass-through waypoints as section boundaries with non-zero velocity from fast trajectory","next_action_hint":"Deviation is structural - caused by DoFs being at different u values near waypoints. Try improving u_ref initialization or tracking to synchronize DoFs at waypoints.","result":"Terrible - duration 10.43s, deviation 0.57, kinematic fail. Adding section boundaries with non-zero v breaks the tracking scheme and fast trajectory computation.","rollback_reason":"All metrics much worse"}}
{"run":11,"commit":"d249a59","metric":3.64,"metrics":{"cloud_duration":7.8705,"cloud_max_dev":0.260108,"cloud_mean_dev":0.108519,"local_duration":8.157,"local_max_dev":0.415785,"local_mean_dev":0.162575},"status":"discard","description":"Best iteration by max_dev: worse duration 8.16, same max_dev","timestamp":1776490018859,"segment":0,"confidence":3.87310606060606,"iterationTokens":729,"asi":{"hypothesis":"Select best tracking iteration by max_path_deviation instead of avg","next_action_hint":"Remove enforce_waypoint_sync since it's not helping. Focus on the u_ref initialization instead.","result":"Worse duration (8.16 vs 7.87), same deviation","rollback_reason":"Duration regressed"}}
{"run":12,"commit":"d249a59","metric":16.02,"metrics":{"cloud_duration":7.8705,"cloud_max_dev":0.260108,"cloud_mean_dev":0.108519,"local_duration":9.1315,"local_max_dev":0.467239,"local_mean_dev":0.187054},"status":"discard","description":"u_ref = min of all DoFs: 16% worse duration, kinematic fail","timestamp":1776490268962,"segment":0,"confidence":3.3442354865085853,"iterationTokens":1313,"asi":{"hypothesis":"Initialize u_ref as element-wise min of all DoFs' fast trajectory u values","rollback_reason":"Duration 16% worse, kinematic failure. Min-of-all is too conservative.","result":"Duration 9.13 (+16%), kinematic fail, deviation 0.47"}}
{"run":13,"commit":"d249a59","metric":13.76,"metrics":{"cloud_duration":7.8705,"cloud_max_dev":0.260108,"cloud_mean_dev":0.108519,"local_duration":8.9534,"local_max_dev":0.331426,"local_mean_dev":0.166131},"status":"discard","description":"Average u_ref + multi-region update: max_dev 0.331 (best yet!) but duration 8.95 (+13.76%)","timestamp":1776490858882,"segment":0,"confidence":4.6477272727272725,"iterationTokens":3613,"asi":{"hypothesis":"Average u_ref reduces max deviation, multi-region update_u_ref helps convergence","result":"Average+multi-region: duration 8.95 (13.76%), max_dev 0.331 (much better), kinematic pass. BUT duration regression is primary metric fail.","key_finding":"Average u_ref significantly reduces max_dev (0.416->0.331) at cost of 13.76% duration gap. Pure average alone is 22.83%. Multi-region update (top-3) helps convergence vs single-region.","rollback_reason":"Primary metric regressed: duration_gap 13.76% vs current best -0.01%"}}
{"type":"config","name":"Local Waypoints Calculator - Multi-region Update + Overshoot Clamp","metricName":"duration_gap_pct","metricUnit":"%","bestDirection":"lower"}
{"run":14,"commit":"a049ea7","metric":-0.01,"metrics":{"local_duration":7.8696,"cloud_duration":7.8705,"local_max_dev":0.456375,"cloud_max_dev":0.260108,"local_mean_dev":0.148399,"cloud_mean_dev":0.108519},"status":"keep","description":"Baseline for new segment: delta_u_ref 0.05, duration -0.01% (7.87s), max_dev 0.456","timestamp":1776520430002,"segment":1,"confidence":null,"iterationTokens":3613,"asi":{"hypothesis":"baseline measurement for new segment with delta_u_ref=0.05","focus":"need to reduce max_dev from 0.456 to closer to cloud 0.260 without regressing duration"}}
{"run":15,"commit":"a049ea7","metric":18.69,"metrics":{"local_duration":9.3418,"cloud_duration":7.8705,"local_max_dev":0.435312,"cloud_max_dev":0.260108,"local_mean_dev":0.162692,"cloud_mean_dev":0.108519},"status":"discard","description":"Multi-region update_u_ref (top-3): duration 18.69%, kinematic fail. Too aggressive.","timestamp":1776520482148,"segment":1,"confidence":null,"iterationTokens":4947,"asi":{"hypothesis":"Update top-3 non-overlapping violation regions per iteration instead of just one","result":"Much worse: duration 9.34 (18.69% gap), kinematic fail. Updating multiple regions destabilizes the tracking.","rollback_reason":"Duration and kinematic regression","next_action_hint":"Try top-2 or just overshoot-only multi-region. Or try a completely different approach - pre-compensating u_ref for initial velocity overshoot."}}
{"run":16,"commit":"a049ea7","metric":4.78,"metrics":{"cloud_duration":7.8705,"cloud_max_dev":0.260108,"cloud_mean_dev":0.108519,"local_duration":8.247,"local_max_dev":0.456381,"local_mean_dev":0.160858},"status":"discard","description":"Probe-and-adjust u_ref for overshoot: duration 4.78%, max_dev 0.456 (same). Just increases duration.","timestamp":1776520628723,"segment":1,"confidence":null,"iterationTokens":8050,"asi":{"hypothesis":"After initial u_ref from slowest DoF, probe track and raise u_ref where any DoF overshoots by > delta","rollback_reason":"Duration regressed to 4.78% without reducing deviation","next_action_hint":"Raising u_ref always increases duration. Need approach that reduces deviation without changing total time. Try: damped update corrections, or solve intermediate trajectory properly."}}
{"run":17,"commit":"a049ea7","metric":-0.01,"metrics":{"local_duration":7.8696,"cloud_duration":7.8705,"local_max_dev":0.415769,"cloud_max_dev":0.260108,"local_mean_dev":0.149142,"cloud_mean_dev":0.108519},"status":"keep","description":"Baseline: smoothness analysis - duration gap -0.01%, max_dev 0.416 (still 60% higher than cloud)","timestamp":1776908775855,"segment":1,"confidence":null,"iterationTokens":8050,"asi":{"hypothesis":"Work on path smoothness to reduce max_dev from 0.416 to closer to cloud's 0.260","root_cause":"DoFs diverge in u-space: DoF with initial wrong-direction velocity overshoots and can't be slowed fast enough due to jerk limits (j_max=10)","key_issue":"At worst deviation time, u values spread: dof1=4.32, dof2=5.36, dof3=4.51 (spread=1.04) vs cloud spread=0.45","action":"Analyze tracking algorithm to understand why DoF2 gets ahead and how to keep DoFs synchronized"}}
